Top queries,Clicks,Impressions,CTR,Position
veteran business grants canada,3,56,5.36%,6.23
small business grants for veterans,2,97,2.06%,8.7
usda sbir phase i 2026,2,34,5.88%,7.09
small business grants,1,69,1.45%,56.41
canada small business grants,1,22,4.55%,61.14
veteran small business grants,1,10,10%,8.8
startup business grants,1,9,11.11%,59.89
washington state department of commerce grants,1,8,12.5%,37.75
veterans business grants,1,6,16.67%,8.33
sba grants 2026,1,6,16.67%,23.17
grants for veteran business owners,1,5,20%,5.8
grants for social enterprises,1,4,25%,4.5
educator technology grants,1,3,33.33%,6
edtech grants,1,3,33.33%,6.33
wes ecosystem fund,1,3,33.33%,45.67
youth entrepreneurship program ontario,1,3,33.33%,52
indigenous start up business grants,1,2,50%,1
new business grants 2026,1,2,50%,1
culinary grants,1,2,50%,4
grants for veteran entrepreneurs,1,2,50%,10.5
grants for healthcare businesses,1,2,50%,11
public health grants 2026,1,2,50%,11.5
grants for hospitality businesses,1,1,100%,1
sba grants 2026 for startups,1,1,100%,1
under 55k,1,1,100%,1
grants for female veterans to start a business,1,1,100%,5
community grants for nonprofits 2026,1,1,100%,9
digital health,1,1,100%,15
women business grants ontario,1,1,100%,19
2026 grants for small business,1,1,100%,43
grants for business students,1,1,100%,70
quebec business grants news,0,4103,0%,10.4
california government funding enterprise content management past 3 months,0,1993,0%,8.13
canada clean energy funding manitoba,0,835,0%,10.44
funding for small business canada,0,678,0%,69.82
business funding in canada,0,606,0%,70
small business funding canada,0,575,0%,71.44
canada small business financing,0,456,0%,62.81
small business funding alberta,0,424,0%,56.1
new funding for website hosting or accessibility in california past 3 months,0,395,0%,11.45
small business funding,0,367,0%,72.44
government funding,0,355,0%,53.4
government grants canada,0,324,0%,46.53
small business funding bc,0,311,0%,76.04
ontario business funding,0,268,0%,75.13
funding for small business,0,267,0%,72.43
"""métis capital corporation"" british columbia",0,260,0%,10.51
indigenous business funding,0,253,0%,73.23
funding for small businesses,0,246,0%,73.04
minnesota business grants,0,203,0%,40.18
funding for small business ontario,0,196,0%,77.93
new york business grants,0,193,0%,51.03
canada grants for small business,0,178,0%,68.02
fsi,0,175,0%,10.32
grants for restaurants 2022,0,173,0%,32.06
women's business resources canada,0,169,0%,63.29
funding for small companies,0,165,0%,76.96
california funding for education technology assessment software,0,162,0%,8.91
business funding for veterans,0,161,0%,14.32
city and county of broomfield arpa technology grants,0,152,0%,10.84
business funding canada,0,146,0%,64.16
business financing canada,0,142,0%,64.96
government funding canada,0,140,0%,46.49
canada business grants,0,137,0%,58.57
"kansas california ohio new york illinois connecticut rhode island new 
funding government technology",0,124,0%,7.06
small business funding for women,0,120,0%,53.91
canada small business financing loan,0,119,0%,62.39
business grants for women,0,117,0%,55.09
technology grants canada,0,116,0%,53.5
canada small business financing program,0,116,0%,55.91
real time grant alerts,0,115,0%,42.33
small business grants for women,0,113,0%,58.22
tech innovation startup funding 2026,0,112,0%,6.66
small business funding for veterans,0,112,0%,26.88
small business loans canada,0,111,0%,63.95
ai education grant 2026,0,109,0%,8.75
grants government of canada,0,108,0%,37.09
gov grants canada,0,108,0%,45.73
missouri small business grants,0,106,0%,49.67
small business grants missouri,0,104,0%,51.65
how to get approved for canada digital adoption program,0,103,0%,45.96
grants for women in business canada,0,102,0%,46.88
business grants for veterans,0,101,0%,9.05
women-owned business grants canada,0,101,0%,42.19
marketing grants canada,0,101,0%,76.53
technology grants,0,99,0%,33.38
business grants wisconsin,0,99,0%,58.61
startup funding,0,98,0%,68.18
"""jobsohio inclusion grant"" ""up to $50,000""",0,97,0%,9.6
business grants missouri,0,97,0%,50.02
government grants in canada,0,96,0%,43.77
grants for women owned businesses,0,96,0%,45.64
innovation funding,0,96,0%,57.07
women in business grants canada,0,95,0%,43.44
grants money canadian government,0,92,0%,30.73
innovation fund,0,91,0%,54.51
invest in massachusetts institute of technology startups,0,91,0%,57.1
ladies business loan,0,91,0%,73.25
canadian government grant,0,90,0%,41.53
cdap digital adoption plan guide,0,89,0%,36.53
canadian grants for women entrepreneurs,0,89,0%,48.34
small business loan canada,0,88,0%,67.95
restaurant cash flow manitoba,0,85,0%,12.82
government grants for hard hats past 3 months kentucky,0,84,0%,11.42
canada business funding,0,84,0%,59.07
canada digital adoption program small business bc,0,83,0%,36.34
small business financing,0,83,0%,57.2
canadian government grants,0,82,0%,52.24
manufacturer funding,0,81,0%,35.78
grants for female business owners,0,81,0%,55.33
nys small business grants,0,80,0%,48.96
small business grants for women owned busineses massachusetts,0,79,0%,10.7
business funding for small business,0,75,0%,72.67
invest in new york university startups,0,74,0%,60.07
"""métis capital corporation"" mnbc",0,73,0%,7.99
startup ny,0,73,0%,24.75
grants canada government,0,73,0%,43.55
grants and funding,0,73,0%,70.48
csbfp,0,72,0%,45.88
female small business grants,0,72,0%,53.6
women owned small business grants,0,71,0%,45.54
government funds,0,70,0%,56.29
grants for technology startups,0,69,0%,36.52
woman owned small business grants,0,69,0%,46.9
canada business financing,0,68,0%,63.35
"""métis capital corporation"" ""british columbia""",0,67,0%,10.24
funding for managed it services in minnesota state government 2026,0,65,0%,10.94
business loans saskatchewan,0,65,0%,41.75
clean tech startups bc,0,64,0%,55.94
small business saskatchewan,0,63,0%,48.4
canadian grants,0,63,0%,57.14
funding for canadian scale-ups,0,63,0%,58.52
tech grants canada,0,62,0%,43
small business funding saskatchewan,0,61,0%,40.31
digital grant ontario,0,61,0%,49.16
women entrepreneurship fund wef saskatchewan eligibility requirements,0,60,0%,8.13
women entrepreneurship fund (wef),0,60,0%,9.5
restaurant funding,0,60,0%,19.17
canada technology grants,0,60,0%,43.52
women owned business grants,0,59,0%,36.46
tech innovation grants,0,58,0%,19.45
saskatchewan small business loans,0,58,0%,33.07
canadian business grants,0,58,0%,51.28
canada digital adoption program 2022,0,58,0%,58
funding for business women,0,58,0%,69.78
business loan saskatchewan,0,57,0%,46
funding,0,57,0%,58.32
startup funding for veterans,0,56,0%,10.66
grants for women entrepreneurs,0,56,0%,59.61
business grants bc,0,56,0%,62.11
"government funding for heavy equipment to start up a business that would 
help agricultural growth",0,54,0%,6.57
business grants california,0,54,0%,53.2
business grants canada,0,54,0%,58.83
digital grants,0,53,0%,42.85
small business loans saskatchewan,0,52,0%,36.04
canada digital adoption program grant application,0,52,0%,39.48
small business finance,0,52,0%,71.37
federal grants canada,0,51,0%,44.71
louisiana r&d tax credit,0,51,0%,48.08
are there grants for women to start a business,0,51,0%,50.29
grants canada,0,51,0%,53.35
how do i apply for a government business grant,0,51,0%,54.73
saskatchewan small business loan,0,50,0%,39.48
technology startup funding,0,50,0%,45.8
startup funding canada,0,50,0%,63.2
small business grants bc,0,50,0%,69.52
young entrepreneurs,0,50,0%,76.1
irap sr&ed canadian innovation funding eligibility,0,48,0%,6.25
"""métis capital corporation"" ""british columbia"" lending",0,48,0%,8.56
canada grants,0,48,0%,51.38
tech startup grants canada,0,47,0%,33.32
female business grants,0,47,0%,60.3
canadian business financing,0,47,0%,60.4
small business loans alberta,0,47,0%,74.55
innovation grants canada,0,46,0%,37.76
business loans for veterans,0,45,0%,28.49
how much is the cdap grant,0,45,0%,36.71
canada government grants,0,45,0%,45.29
canadian small business financing program,0,45,0%,58.33
us small business funding options grants loans sba microloan 2026,0,45,0%,61.33
canada digital adoption program cdap status 2026,0,43,0%,6.93
canadian small business financing,0,43,0%,58.47
ontario grants for small business,0,43,0%,74.14
can i get a government grant to start a business,0,42,0%,55.19
business loans for women in canada,0,42,0%,57.36
canadian small business loan,0,42,0%,63
canadian innovation funding,0,41,0%,31.68
canada small business financing program csbfp maximum loan amount 2026,0,40,0%,5.35
edtech grants for schools,0,40,0%,18.18
government grant,0,40,0%,53.27
small business financing canada,0,40,0%,62.12
digital adoption plan template,0,40,0%,64.6
digital fsi,0,39,0%,7.62
funding for women entrepreneurs,0,39,0%,64.46
canada digital adoption program requirements,0,39,0%,67.08
business grants ontario,0,39,0%,72.33
nih sbir phase i funding amount 2026,0,38,0%,4.55
grants for non profits in bc,0,38,0%,33.24
manufacturing engineering funding,0,38,0%,37.68
women in business alberta,0,38,0%,43.42
small business grants california 2026,0,38,0%,44.13
canadian government funding,0,38,0%,44.42
canada funding,0,38,0%,51.92
does the government give grants to start a business,0,38,0%,55.68
can you get a grant to start a business,0,38,0%,56.29
canada startup grants,0,38,0%,64.95
start up funding,0,38,0%,66.68
ontario small business grants,0,38,0%,72.37
canada digital adoption program status 2026,0,37,0%,7.51
business development assistance ns,0,37,0%,25.32
small business digital grants program,0,37,0%,46.19
where can i get a grant to start a business,0,37,0%,51.16
canadian startup grants,0,37,0%,58.08
ohio business grants 2024,0,37,0%,59.27
what grants can i get to start a business,0,37,0%,60.38
invest in massachusetts startups,0,37,0%,77.92
amber grant application,0,36,0%,10.08
small business grants quebec,0,36,0%,39
startup funding for women,0,36,0%,41.25
how can i get a grant to open a business,0,36,0%,49.64
canada small business grants news,0,36,0%,52.64
how do i get government grants to start a business,0,36,0%,52.78
csbfp loan,0,36,0%,57.64
how do i get grants to start a business,0,36,0%,60.5
business development assistance nb,0,35,0%,37.03
government of canada grants,0,35,0%,43.57
innovation grants,0,35,0%,52.6
government of canada business grants,0,35,0%,53.94
grants digital transformation higher education,0,35,0%,54
how do i get grants for starting a business,0,35,0%,55.49
canada small business loan,0,35,0%,63.69
bronx innovation technology startup news 2026,0,34,0%,9.47
quebec small business grants news,0,34,0%,24.15
federal funding,0,34,0%,50.35
how do i get a grant to open a business,0,34,0%,52.03
how can you get a grant to start a business,0,34,0%,54.97
small business financing program canada,0,34,0%,58.15
how to start a small business in grand rapids mi,0,34,0%,60.41
where can i get a grant for my business,0,34,0%,62.44
how do i get a grant for my business,0,34,0%,64
government grants for small business,0,34,0%,66.21
business loans for women,0,34,0%,72.88
"""pennsylvania"" technology innovation grants",0,33,0%,7.88
chandler business incentive and funding,0,33,0%,9.18
small business funding in new york,0,33,0%,38.88
where to get a grant to start a business,0,33,0%,51.94
technology development grants canada,0,33,0%,63.27
apply for small business grant,0,33,0%,68.33
grants for deep tech startups 2026,0,32,0%,6.09
"""georgia"" technology innovation grants",0,32,0%,7.66
montreal manufacturing grants,0,32,0%,10.09
federal government canada grants,0,32,0%,40.53
federal government grants,0,32,0%,42.47
women entrepreneur grants,0,32,0%,48.28
where do i apply for a small business grant,0,32,0%,53.56
new business loans canada,0,32,0%,60.41
canada startup funding,0,32,0%,61.06
canada small business financing program maximum loan amount 2026,0,31,0%,5.42
nih sbir phase i award amount 2026,0,31,0%,5.84
small business loans women owned business,0,31,0%,56.32
small business grants canada,0,31,0%,60.97
federal manufacturing grants,0,31,0%,63.35
canada small business funding,0,31,0%,63.39
canadian government grants for small business,0,31,0%,64.39
grants availble chicago women owned buiness,0,30,0%,7.17
"government grants for ai agent development in massachusetts california 
texas north carolina georgia florida virginia new york",0,30,0%,7.23
hospitality equipment funding,0,30,0%,18.37
affordable housing canada funding,0,30,0%,37.6
quebec small business grants,0,30,0%,44.93
small business help nb,0,30,0%,47.07
small business grants alberta,0,30,0%,54.73
canadian small business grants,0,30,0%,61.93
grants for female entrepreneurs,0,30,0%,62.53
funding for startups,0,30,0%,63.13
female entrepreneur grants,0,30,0%,69.87
california servicenow license funding 2026,0,29,0%,9.86
economic development incentives california 2026,0,29,0%,13.03
regional development grants canada,0,29,0%,22.48
technology funding,0,29,0%,44.03
government funding programs canada,0,29,0%,45.03
female owned business grants,0,29,0%,45.55
women business grants,0,29,0%,53.28
can you get a government grant to open a business,0,29,0%,55.76
how do i apply for a small business grant,0,29,0%,56.1
csbf loan,0,29,0%,58.1
canadian small business financing loan,0,29,0%,60.76
alberta small business loans,0,29,0%,69.86
california ibank small business loan guarantee program 2026,0,28,0%,3.96
canada digital adoption program cdap 2026 status,0,28,0%,7.82
business incentives in chandler,0,28,0%,10
flexible business financing minneapolis,0,28,0%,17.54
small business grants new york state,0,28,0%,34.64
minnesota small business grants,0,28,0%,35.75
grants for startups canada,0,28,0%,63.71
"singer instruments startup criteria semiconductor biomedical hardware 
series b c funding 2025-2026 us",0,27,0%,10.33
technology innovation grants,0,27,0%,26.44
government of canada funding,0,27,0%,41.22
canada business grant,0,27,0%,54.41
government grants,0,27,0%,57.74
female entrepreneur grants canada,0,27,0%,57.96
women entrepreneurship fund,0,27,0%,63.93
state grants for small business,0,27,0%,70.56
federal grants for small business,0,27,0%,73.48
usa small business grants where to apply sba grants program business,0,27,0%,75.44
government guaranteed loans,0,26,0%,25.62
startup funding houston,0,26,0%,36.46
federal funding programs canada,0,26,0%,43.46
can i get government funding to start my own business,0,26,0%,52.65
digital transformation grants,0,26,0%,55.08
federal small business grants,0,26,0%,55.85
canadian government business grants,0,26,0%,55.88
small business grants in missouri,0,26,0%,56.15
women in business grants,0,26,0%,56.69
are there any web development grants or subsidies available in canada,0,26,0%,57.77
canadian small business loans,0,26,0%,59.42
"""new york"" technology innovation grants",0,25,0%,8.96
philadelphia retail business grants,0,25,0%,15.6
global ny fund grant program,0,25,0%,20.84
apply for working capital loan minneapolis,0,25,0%,29.76
small business grants new york,0,25,0%,45.4
where can i apply for a small business grant,0,25,0%,48.04
grants for women in business,0,25,0%,55.76
tech startup funding,0,25,0%,58.76
entrepreneur grants canada,0,25,0%,62.56
small business financing program,0,25,0%,69.08
how to qualify as a small minority business and who do i register with,0,24,0%,10.96
business incentives for relocating to bellevue,0,24,0%,13.96
retail business grants in philadelphia,0,24,0%,16.5
economic services grants for nonprofits,0,24,0%,20.12
business support grand rapids mi,0,24,0%,40.25
loans for minority owned businesses,0,24,0%,41.58
grants for female owned businesses,0,24,0%,51.58
how do i get a grant for my small business,0,24,0%,54.92
grants for businesses in canada,0,24,0%,61.29
government grants for starting a business,0,24,0%,65.42
business financing software,0,24,0%,88.21
nsf sbir phase i award amount 2026,0,23,0%,8.61
small business grants ontario 2026,0,23,0%,12.48
"arkansas small business grant workforce 2026 apply -site:docs.google.com 
-site:drive.google.com -site:scribd.com -site:slideshare.net 
-site:academia.edu -site:pinterest.com -site:pinterest.co.uk 
-site:reddit.com -site:quora.com -site:facebook.com -site:instagram.com 
-site:tiktok.com -site:twitter.com -site:x.com -site:youtube.com 
-site:jobs2careers.com -site:jobspider.com -site:jobcase.com 
-site:salary.com -site:jobgoround.com",0,23,0%,17.35
funding for tech startups in orange county,0,23,0%,24.3
nasa sbir grant for startups space startup grant application,0,23,0%,24.39
nih taba funding support health tech,0,23,0%,34.65
women's business network alberta,0,23,0%,49.39
new business grants alberta,0,23,0%,51.04
ai grants canada,0,23,0%,51.17
irap funding,0,23,0%,53.26
alberta new business grants,0,23,0%,55.35
small business loans for women,0,23,0%,75.13
us federal stimulus programs for small businesses how to apply 2026,0,23,0%,81.91
"""fort wayne"" ""in"" municipal grants small business",0,22,0%,10.64
empire state development grants,0,22,0%,23.27
top startup accelerators & incubators in california,0,22,0%,37.77
can i get a grant to start my own business,0,22,0%,42.14
business loans for minorities,0,22,0%,44.18
small business grants in minnesota,0,22,0%,45.91
small business loans for minorities,0,22,0%,46.23
federal government grant,0,22,0%,49.77
canada digital adoption program reddit,0,22,0%,50.09
small business grants in kentucky,0,22,0%,51
how to get a small business grant,0,22,0%,56.68
how can i apply for a small business grant,0,22,0%,58.14
canada small business financing program csbfp,0,22,0%,60.59
women small business grants,0,22,0%,64.27
what do i need to get a government grant,0,22,0%,69.68
small business grants in wisconsin,0,22,0%,69.73
business grants bc canada,0,22,0%,71.41
fsi canada,0,21,0%,5.05
"""texas"" technology innovation grants",0,21,0%,10.71
funding available per industry,0,21,0%,25.48
r&d grants canada,0,21,0%,29.24
are there any grants to start up a business,0,21,0%,42.52
young canadian entrepreneurs,0,21,0%,51.24
government canada grants,0,21,0%,54.71
federal business grants canada,0,21,0%,55.57
government grants for small business canada,0,21,0%,62.62
small business grants in iowa,0,21,0%,66.24
small business grants in new york,0,21,0%,66.9
small business grants in oregon,0,21,0%,71.48
female business loans,0,21,0%,77.62
e commerce grants canada,0,21,0%,81.05
invest in corpus christi startups,0,21,0%,81.14
e-commerce grants canada,0,21,0%,82.43
women entrepreneurs grants 2025 san francisco bay area,0,20,0%,8.9
california small business loan guarantee program ibank 2026,0,20,0%,9.15
"north carolina ontario student fees management payment processing 
government grants",0,20,0%,10.5
business grants mn,0,20,0%,36.15
innovation funding canada,0,20,0%,38.3
grants for women,0,20,0%,38.65
funding support for medtech commercialization,0,20,0%,43.2
canadian funding,0,20,0%,48.55
innovation in quebec,0,20,0%,53.4
women export business loans,0,20,0%,55.95
grants for small business alberta,0,20,0%,56.95
business grants in canada,0,20,0%,59.25
indigenous entrepreneurs,0,20,0%,59.6
grants for small business women,0,20,0%,59.7
grants for women entrepreneurs canada,0,20,0%,59.8
business grants for woman,0,20,0%,65.6
business funding,0,20,0%,70.45
"""minneapolis"" ""mn"" municipal grants small business",0,19,0%,10.32
bellevue wa small business loans,0,19,0%,25.11
loan for startup business nb,0,19,0%,45
government grants for businesses,0,19,0%,45.84
city of calgary small business grants,0,19,0%,53.21
alberta grants for small business,0,19,0%,53.26
alberta small business grants,0,19,0%,55.89
grants for women owned business,0,19,0%,56.32
manufacturing grants canada,0,19,0%,60.42
grants for indigenous business,0,19,0%,65.84
csbf,0,19,0%,68.05
small business grants massachusetts,0,19,0%,75.05
funding startup,0,19,0%,76.74
"""créativité québec"" investissement québec",0,18,0%,4.61
nsf sbir phase i funding amount 2026,0,18,0%,5.17
nsf america's seed fund phase i funding amount 2026 official,0,18,0%,9
edc venture capital,0,18,0%,22.56
loans for minorities,0,18,0%,29.56
government grants for tech startups,0,18,0%,31.61
where can i find grants to start a business,0,18,0%,33.89
sba accepting new applications,0,18,0%,34.11
kentucky small business grants,0,18,0%,39.61
federal grants,0,18,0%,40.67
clean energy grants,0,18,0%,42.5
funding for tech startups,0,18,0%,44.56
machine learning rfp,0,18,0%,48.11
business startup loans nb,0,18,0%,48.22
apply for commercial business loan minneapolis,0,18,0%,51.94
wisconsin business grants,0,18,0%,54.17
alberta business grants,0,18,0%,54.28
canada entrepreneur grants,0,18,0%,55.17
canada small business financing program guidelines,0,18,0%,55.61
government funding for manufacturing canada,0,18,0%,59.83
business grant for women,0,18,0%,61.17
funds for women owned businesses,0,18,0%,63.83
government funding for automation,0,18,0%,63.89
invest in ma startups,0,18,0%,76.33
"""jobsohio inclusion grant"" ""$500,000""",0,17,0%,6.65
women entrepreneurship strategy canada grants 2026,0,17,0%,7.41
"""california"" technology innovation grants",0,17,0%,8.29
"""métis capital corporation"" ""british columbia"" lending institution",0,17,0%,9.47
usda rural business development grant 2026 deadline,0,17,0%,10.18
us government small business grants,0,17,0%,15.76
aerospace development grants,0,17,0%,16.41
how to apply for nasa sbir space startup,0,17,0%,17.88
small business loans for veterans,0,17,0%,26.65
funding sources for business expansion 2026,0,17,0%,37.24
federal government grant canada,0,17,0%,50.59
canada federal grants,0,17,0%,50.65
business incentives kansas city,0,17,0%,55.24
wisconsin small business grants,0,17,0%,60.24
women entrepreneurship loan fund,0,17,0%,62.65
grant for women in business,0,17,0%,66.18
small business funding in washington,0,17,0%,67.94
grants for digital marketing,0,17,0%,74.76
indigenous loans canada,0,17,0%,76.53
"new funding for permitting software in virginia, illinois, florida, 
ontario, british columbia",0,16,0%,6.81
canada small business financing program eligibility 2026,0,16,0%,10.69
montreal tech grants,0,16,0%,11.38
quebec manufacturing grants,0,16,0%,12.88
"""women entrepreneurship fund"" or wef saskatchewan women entrepreneurs 
eligibility",0,16,0%,17.94
amber grant canada,0,16,0%,18.25
small business loan minneapolis,0,16,0%,25.38
funding for employers in richmond va,0,16,0%,29.44
funding for tech companies,0,16,0%,34.44
canada innovation fund,0,16,0%,38.75
government business incentives,0,16,0%,39.31
innovation canada funding,0,16,0%,39.75
can you get a grant to start your own business,0,16,0%,39.88
business startup help nb,0,16,0%,42.19
federal government grants canada,0,16,0%,45.06
research and development grants canada,0,16,0%,47.94
women owned business grants canada,0,16,0%,49.56
funding for small business in alberta,0,16,0%,50.38
alberta business grant,0,16,0%,51.19
"learn how the canada small business financing program can help grow your 
business",0,16,0%,52.69
canada grant,0,16,0%,53.44
government of canada small business grants,0,16,0%,57.12
grants for female entrepreneurs canada,0,16,0%,57.38
canadian business loan,0,16,0%,58.25
canada small business grant,0,16,0%,58.31
manufacturing grants,0,16,0%,59.12
start up business grants bc,0,16,0%,60.81
csbfl loan,0,16,0%,63.5
women in small business grants,0,16,0%,65.31
small business grants ontario,0,16,0%,70.75
business loan canada,0,16,0%,74.56
canada digital adoption program cdap current status 2026,0,15,0%,7.4
nih sbir phase i maximum award amount 2026,0,15,0%,8.13
manitoba small business grants 2026,0,15,0%,8.47
illinois dceo small business grants 2026,0,15,0%,9
"""massachusetts"" technology innovation grants",0,15,0%,9.93
irvine ca tech startup growth guide,0,15,0%,19.73
grants for tech startups,0,15,0%,39.6
nonprofit grants manitoba,0,15,0%,45.13
canada government grant,0,15,0%,48.27
business grants ohio,0,15,0%,49.8
alberta government grants for small business,0,15,0%,52.8
business grants alberta,0,15,0%,57.4
kansas city business incentives,0,15,0%,57.67
tech grants,0,15,0%,58.2
small business grant canada,0,15,0%,60
canadian business funding,0,15,0%,61.47
startup program,0,15,0%,62
canada small business loan program,0,15,0%,63.47
canadian grant for small business,0,15,0%,64
small business grants in washington,0,15,0%,65.6
women's business grant,0,15,0%,65.8
grants in canada for small business,0,15,0%,66.93
canada government small business grants,0,15,0%,67.73
access working capital,0,15,0%,69.6
federal grants for manufacturing,0,15,0%,70.13
small business loan canada $40000,0,15,0%,71
canadian business grants for small businesses,0,15,0%,73.27
grants to start a business,0,15,0%,74.27
federal grants for small business start up,0,15,0%,83.93
how do i get a grant from the government,0,15,0%,84.53
canada small business financing program official 2026,0,14,0%,6.86
nsf sbir phase i success rate 2025 2026,0,14,0%,9.57
montana small business grants 2026,0,14,0%,10.64
regional planning funding,0,14,0%,11
mn small business grants,0,14,0%,29.64
nasa technology funding,0,14,0%,31.21
atlantic innovation fund,0,14,0%,32.07
funding for technology startups,0,14,0%,32.14
minnesota grants for small businesses,0,14,0%,35.79
canadian government grants never repay,0,14,0%,36.29
grant money canada,0,14,0%,41.57
research and development funding canada,0,14,0%,42.93
funding canada,0,14,0%,45.14
small business startup funding houston,0,14,0%,47.14
manufacturing funding,0,14,0%,49
small business alberta,0,14,0%,50.79
federal government grant money,0,14,0%,55
women's business resources,0,14,0%,58
government business grants canada,0,14,0%,59.36
small business women grants,0,14,0%,60.29
startup grants canada,0,14,0%,60.93
grants for canadian business,0,14,0%,62.21
women business grant,0,14,0%,62.5
canadian grants for new business,0,14,0%,63.93
