Top queries,Clicks,Impressions,CTR,Position
canada funding for small business,0,14,0%,64.86
small business incentives in iowa,0,14,0%,65
csbfl,0,14,0%,68.79
ai grant,0,14,0%,69.21
minnesota launch mn innovation grants amounts 2026,0,13,0%,7.54
canada small business financing program loan limits 2026,0,13,0%,7.85
launch mn innovation grants amounts 2026,0,13,0%,7.85
canada digital adoption program 2026 status,0,13,0%,9.69
"""métis capital corporation"" bc",0,13,0%,10.46
federal funding for women in business,0,13,0%,11.08
low cost tech device business opportunities manitoba or winnipeg,0,13,0%,11.85
atlanta ai startup grants funding opportunities 2026,0,13,0%,11.92
amber grant requirements,0,13,0%,12.08
scotiabank women in business wib program advice evaluation,0,13,0%,18.31
youth entrepreneurship support,0,13,0%,24.92
top small business startup funding in houston,0,13,0%,37.92
quebec grants for small business,0,13,0%,41.77
state of minnesota small business grants,0,13,0%,42.62
invest in ri startups,0,13,0%,44.08
america's seed fund,0,13,0%,44.31
houston small business startup funding,0,13,0%,45.23
canadian grant,0,13,0%,45.92
start a fund manitoba,0,13,0%,46.77
federal goverment grant,0,13,0%,47.31
grants for small businesses alberta,0,13,0%,49.77
funding for technology companies,0,13,0%,51.46
business development loans nb,0,13,0%,51.77
grants and government,0,13,0%,51.77
grants canada for small business,0,13,0%,56.54
startup grants,0,13,0%,57.85
alberta grant for business,0,13,0%,58.08
grant for business canada,0,13,0%,59
business grant canada,0,13,0%,60.92
canada startups grants,0,13,0%,61.31
grants for small business canada,0,13,0%,61.69
startup business funding canada,0,13,0%,63.69
small business financing loan,0,13,0%,65.08
grant for small business canada,0,13,0%,65.69
women tech startup loans,0,13,0%,67.62
free canadian government grants for small business,0,13,0%,68.23
grow your business online grant ontario,0,13,0%,76.62
how to get a business loan in canada,0,13,0%,77.08
restaurant revitalization,0,12,0%,2
texas state grants startups medtech space defense 2026,0,12,0%,4.58
usda sbir 2026,0,12,0%,6.42
welf canada,0,12,0%,6.67
fsi og,0,12,0%,8.42
quebec manufacturing funding,0,12,0%,12.17
minnesota small business grants 2026,0,12,0%,14.42
quebec tech startup funding,0,12,0%,16.58
saskatchewan small business grants,0,12,0%,35.25
federal grant,0,12,0%,43.33
grant canada,0,12,0%,44.42
start up business grants,0,12,0%,47.33
federal funding program,0,12,0%,48.08
new york state small business grants,0,12,0%,49
tech startup funding canada,0,12,0%,52.08
government grants for innovation,0,12,0%,53.08
canada new business grants,0,12,0%,56.92
small business grants wisconsin,0,12,0%,57.42
sba grants for women,0,12,0%,60.08
new york small business grants,0,12,0%,61.92
grants for small businesses canada,0,12,0%,62.58
grants canada 2024,0,12,0%,63.33
grants for small business in canada,0,12,0%,64.33
canadian small business finance program,0,12,0%,64.58
digital marketing grants,0,12,0%,65.33
women in business canada,0,12,0%,65.75
artificial intelligence grants,0,12,0%,67.17
government grants for technology,0,12,0%,68.08
government funding for technology,0,12,0%,69.67
how to apply for small business grants,0,12,0%,70.17
grants for small businesses in ontario,0,12,0%,73.67
how do i apply for a grant from the government,0,12,0%,74.75
business incentives,0,12,0%,75.42
small business loans or grants,0,12,0%,76.17
federal grants in the united states,0,12,0%,78.67
federal grants for small business start-up,0,12,0%,78.83
"""métis capital corporation"" ""métis nation british columbia""",0,11,0%,8.18
"""virginia"" technology innovation grants",0,11,0%,9.27
amber grant for women canada,0,11,0%,10.36
farm working capital colorado springs,0,11,0%,12.09
small business grants arkansas 2026,0,11,0%,14.73
sbir sttr funding opportunities 2026 hot sectors,0,11,0%,17.73
business grants,0,11,0%,23.73
quebec city business grants,0,11,0%,25.55
sba usda program,0,11,0%,26.09
nserc i2i,0,11,0%,28.27
mn grants for small business,0,11,0%,35.82
manufacturing funding new york,0,11,0%,37.82
early stage funding colorado,0,11,0%,38.73
irap application support,0,11,0%,39.73
green energy grant,0,11,0%,42
irap funding criteria,0,11,0%,44.45
technology grants ontario,0,11,0%,45
startup funding oregon,0,11,0%,45.27
government funding for tech startups,0,11,0%,45.36
grants for small businesses,0,11,0%,45.36
sme grants,0,11,0%,45.55
government of canada grant,0,11,0%,45.82
us university grants digital transformation,0,11,0%,46.73
canada grants for individuals,0,11,0%,53.36
kentucky grants for small businesses,0,11,0%,54.64
small business grant alberta,0,11,0%,55
sr&ed grants tech startups,0,11,0%,56.91
csbfa,0,11,0%,57.09
small business grants iowa,0,11,0%,57.09
new business grants canada,0,11,0%,57.27
small business loan guarantee program,0,11,0%,57.82
canada small business loans,0,11,0%,58
oregon small business grants,0,11,0%,59.18
canada grants small business,0,11,0%,59.91
digital transformation grant,0,11,0%,62.09
small business grants in canada,0,11,0%,62.09
government manufacturing grants,0,11,0%,62.73
business startup funding canada,0,11,0%,62.91
small business grants oregon,0,11,0%,63.45
canadian startup funding,0,11,0%,64.18
metis business grants,0,11,0%,65.09
women manufacturing business loans,0,11,0%,66.73
canada start up business grants,0,11,0%,68.73
ontario business grants,0,11,0%,69.45
small business loan alberta,0,11,0%,70.91
grants to help start a business,0,11,0%,77.91
startup business funding,0,11,0%,78.45
benefits of indigenous entrepreneurship,0,11,0%,79.45
loans for female business owners,0,11,0%,79.55
how to apply for federal grants for business growth,0,11,0%,82.09
parallex labs canadian r&d funding requirements,0,10,0%,5.7
nrc irap application processing time weeks,0,10,0%,6
"""jobsohio inclusion grant"" ""$50,000"" eligibility",0,10,0%,8.3
baltimore county boost fund eligibility veteran-owned,0,10,0%,9.7
nih sbir sttr standard due dates 2026,0,10,0%,10
new york small business grants empire state development,0,10,0%,10.9
grants for small businesses that don't need to be repaid 2026,0,10,0%,11
san diego small business grants 2026,0,10,0%,11
idaho small business grants 2026,0,10,0%,14
fsi blog7,0,10,0%,14.3
missouri secretary of state business registration tech incentives grants,0,10,0%,18.4
scotiabank women initiative,0,10,0%,21.5
amber grant for women application,0,10,0%,24
clean technology funding canada,0,10,0%,24.6
quebec city grants,0,10,0%,25.1
empire state development grant,0,10,0%,26
manfacturing startup funding new york,0,10,0%,29.3
grant assistance,0,10,0%,35.3
social enterprise funding,0,10,0%,35.9
small business grants minnesota,0,10,0%,36.2
nevada business grants,0,10,0%,37.1
funding assistance,0,10,0%,37.9
startup new york tax incentives,0,10,0%,38.5
bdc digital adoption,0,10,0%,39.6
minnesota small business grant,0,10,0%,40.5
startup funding vancouver,0,10,0%,41.5
r&d grants,0,10,0%,42
small business grants kentucky,0,10,0%,43.1
irap funding 2021,0,10,0%,44.5
small business grants saskatchewan,0,10,0%,44.9
indigenous business grants,0,10,0%,45.2
grant money in canada,0,10,0%,46.6
alberta small business grant,0,10,0%,47.7
missouri small business grant program,0,10,0%,49.6
grand rapids mi small business loans,0,10,0%,50.4
louisiana research and development tax credit,0,10,0%,52.1
the canada small business financing program,0,10,0%,53.5
grants from government,0,10,0%,55.8
federal government grant program,0,10,0%,56
iowa small business grants,0,10,0%,56.4
startup loans nb,0,10,0%,59
canada grants for startups,0,10,0%,64
funding for startups canada,0,10,0%,66.7
sr&ed guide,0,10,0%,70.8
small business grants in washington state,0,10,0%,72.2
grow your business grant,0,10,0%,75
funding a small business,0,10,0%,78.5
manufacturing grants 2024,0,10,0%,86.8
"""jobsohio inclusion grant"" ""annual revenue""",0,9,0%,8.78
california ibank small business loan guarantee program official,0,9,0%,10.33
alaska small business grants 2026,0,9,0%,10.67
women in tech grants,0,9,0%,11.89
minneapolis business program,0,9,0%,19.44
startup new york program,0,9,0%,20.78
equity free accelerator,0,9,0%,21
ontario innovation grant plus all province versions,0,9,0%,22.44
canada irap grant 2025 deadline applications,0,9,0%,28.89
vancouver startup funding,0,9,0%,28.89
scotiabank grants,0,9,0%,34.89
bc business grants,0,9,0%,37.56
small business grants mn,0,9,0%,37.78
new york state seed funding grant program,0,9,0%,38
new york state grants,0,9,0%,38.44
cdap 2400,0,9,0%,39.44
small business financing saskatchewan,0,9,0%,41.22
oregon business grants,0,9,0%,46.89
technology grant canada,0,9,0%,47.22
application for business funding,0,9,0%,47.89
new york state grants and loans small business,0,9,0%,48
business grants in missouri,0,9,0%,49
grants in canada,0,9,0%,50
grant in canada,0,9,0%,50.78
federal government small business grants,0,9,0%,51
grants from the government,0,9,0%,55
canadian goverment grants,0,9,0%,55.89
federal govt grant,0,9,0%,56.44
tech start up funding,0,9,0%,57
missouri grants for small business,0,9,0%,57.44
gov grants,0,9,0%,57.89
young entrepreneurs canada,0,9,0%,58.78
canadian government grants for startups,0,9,0%,59.78
government of canada grants for business,0,9,0%,59.78
small business grants toronto,0,9,0%,59.89
canadian grants and loans,0,9,0%,60.78
business loan from government,0,9,0%,61
wi small business grants,0,9,0%,61.67
grants for small businesses in missouri,0,9,0%,61.89
canadian grants for small businesses,0,9,0%,62.22
canada small business financing program eligibility,0,9,0%,62.67
canadian grants for small business,0,9,0%,63.78
business startup grants canada,0,9,0%,63.89
"u.s. small business administration grants federal grants for starting a 
business official",0,9,0%,64.11
washington state small business grants,0,9,0%,64.22
canadian business grants ontario,0,9,0%,64.56
start up business grants canada,0,9,0%,65.33
business incentives in iowa,0,9,0%,66.11
women entrepreneurship programs,0,9,0%,66.22
delaware grants for small businesses,0,9,0%,66.44
ai grants,0,9,0%,67.44
small business grants ontario canada,0,9,0%,69.11
csbl loan,0,9,0%,69.33
grants and incentives,0,9,0%,70.56
technology incentives,0,9,0%,71.56
grants for canadian businesses,0,9,0%,71.89
ontario grants for small businesses,0,9,0%,74
government funding for technology projects,0,9,0%,79.56
business loans women,0,9,0%,80.33
"""district of columbia"" agriculture grants farmers",0,8,0%,3.25
miami companies hiring expansion funding 2026,0,8,0%,7
best agricultural financing for startups,0,8,0%,8.5
canadian government grant eligibility assessment,0,8,0%,9.38
"2026 federal grants for ai in agriculture and food technology, usda small 
business innovation",0,8,0%,9.5
minneapolis small business grants 2026,0,8,0%,10.12
canada digital adoption program status 2026 official,0,8,0%,10.75
"florida state and local grant funding programs 2026 for technology, ai, and 
software small businesses",0,8,0%,10.75
kentucky small business grants 2026,0,8,0%,12.62
government grants and loans for first-time entrepreneurs 2026,0,8,0%,17.38
access to funding and investors in bellevue,0,8,0%,22
nsf seed funding,0,8,0%,23
equity-free startup accelerator,0,8,0%,25.38
government grants for accelerators,0,8,0%,27.75
i2i nserc,0,8,0%,27.88
business grants montreal,0,8,0%,28.5
non repayable grants canada,0,8,0%,30.5
apply online business loan minneapolis,0,8,0%,32.62
bc manufacturing grant,0,8,0%,34.12
government grants canada technology,0,8,0%,34.88
cdap technology grant,0,8,0%,36.12
nyc business grants,0,8,0%,36.25
small business grants ny,0,8,0%,36.62
renewable energy grants canada,0,8,0%,37
innovation canada grants,0,8,0%,37.25
canada government funding,0,8,0%,38.12
nyc small business grants,0,8,0%,38.25
canada tech grants,0,8,0%,39.88
health canada funding,0,8,0%,40
startup resources new york,0,8,0%,40.25
government of canada grants and contributions,0,8,0%,42
crop financing for farmers minneapolis,0,8,0%,42.38
federal funding application process,0,8,0%,43.88
women entrepreneurship programs california,0,8,0%,44.88
canadian grants for women,0,8,0%,45.25
cra grants,0,8,0%,46.25
ontario government grants,0,8,0%,46.25
women in tech canada,0,8,0%,46.88
small business startup grants oregon,0,8,0%,47.12
federal gov small business grants,0,8,0%,48.38
washington state grants,0,8,0%,49.12
government of canada funding programs,0,8,0%,49.38
sme grant funding canada,0,8,0%,49.75
small business grants houston,0,8,0%,49.88
ny small business grants,0,8,0%,53
government funding programs,0,8,0%,53.5
grants for startups,0,8,0%,53.62
small business loans saskatoon,0,8,0%,53.62
small business grants in ky,0,8,0%,55
irap program,0,8,0%,58.12
indigenous business grant,0,8,0%,59.25
grants for entrepreneurs canada,0,8,0%,59.5
government grants for businesses canada,0,8,0%,62.25
csbfl program,0,8,0%,64.12
tax incentives business iowa,0,8,0%,64.62
bc small business grants,0,8,0%,65.88
government grant for small business,0,8,0%,65.88
startup funding in canada,0,8,0%,66.12
canada small business financing loan csbfl,0,8,0%,66.5
digital grants canada,0,8,0%,66.5
canadian small business loan program,0,8,0%,67.5
state of iowa small business grants,0,8,0%,69.62
grants for new businesses canada,0,8,0%,70.38
grants for small business,0,8,0%,71.12
grant for small business,0,8,0%,72.38
women business loans,0,8,0%,72.5
small business start up grants ontario,0,8,0%,73.5
free government grants for small business,0,8,0%,75
startup business loan for women,0,8,0%,77.25
small business funding in wisconsin,0,8,0%,77.62
sba loan,0,8,0%,80.5
funding digital transformation,0,8,0%,86.5
nih sbir phase ii award amount 2026,0,7,0%,7
whirlpool government grant 2026,0,7,0%,7.43
restaurant relief,0,7,0%,9
america's seed fund nsf sbir phase i funding amount 2026,0,7,0%,9.57
women entrepreneurship strategy canada grants,0,7,0%,9.86
bdc women entrepreneur loan,0,7,0%,10.14
"canada dei black indigenous women entrepreneurship funding grant program 
news may june 2026",0,7,0%,10.14
alberta small business grants 2026,0,7,0%,11.86
easiest small business grants to apply for 2026,0,7,0%,14.86
health canada grants,0,7,0%,17.29
sba microloan program details 2026,0,7,0%,18.14
small business government affairs quebec,0,7,0%,20
nsf sbir deadlines 2026,0,7,0%,20.43
get nrc irap grant,0,7,0%,21.43
business funding opportunities buffalo,0,7,0%,24.71
erp software for smes surrey,0,7,0%,24.86
funding for technology,0,7,0%,25
amber grant application example,0,7,0%,27.71
philadelphia startup grants,0,7,0%,28.57
startup business loans minneapolis mn,0,7,0%,28.57
small business grants in vermont,0,7,0%,28.71
free grants to start a business,0,7,0%,29.71
female entrepreneur grants ontario,0,7,0%,31.14
mn business grants,0,7,0%,33
apply for funding for small business,0,7,0%,33.29
non profit grants bc,0,7,0%,34
new york business incentives,0,7,0%,34.71
provincial innovation incentives,0,7,0%,36.43
government funding for canadian businesses,0,7,0%,38.71
small business grants in new york state,0,7,0%,40
sba women owned business grants,0,7,0%,40.29
tech startup grants,0,7,0%,40.43
youth entrepreneurship program,0,7,0%,40.86
csbfp eligibility,0,7,0%,42.57
federal grants for small business canada,0,7,0%,43.29
early stage funding denver,0,7,0%,43.43
innovation fund canada,0,7,0%,44.57
digital grant,0,7,0%,45.43
10 year equipment loan,0,7,0%,46
best small business startup funding in houston,0,7,0%,46.86
canadian grant money,0,7,0%,47.14
small business start up grants,0,7,0%,47.14
research and development grants,0,7,0%,49.86
canada r&d,0,7,0%,50.14
green grants canada,0,7,0%,50.71
biotech project funding,0,7,0%,52.29
government of canada small business loan,0,7,0%,52.29
health funding,0,7,0%,52.29
digital grants for small business,0,7,0%,53.57
industrial research assistance program irap,0,7,0%,54.86
government business loan,0,7,0%,55.43
small business administration grants resources start a small business,0,7,0%,56
small business grants arizona,0,7,0%,56.14
"as a small business owner, can you provide me detailed information on how i 
can apply for a capital grant to expand my operations",0,7,0%,56.43
cbsf program,0,7,0%,56.43
business incentives iowa,0,7,0%,56.71
canada small business program,0,7,0%,57.14
entrepreneurship grants canada,0,7,0%,57.43
small business grants washington state,0,7,0%,57.43
government of canada small business loans,0,7,0%,58.86
oregon small business grant,0,7,0%,58.86
grant funding for innovation,0,7,0%,59.71
indiana small business grants,0,7,0%,61.86
business assistance for iowa,0,7,0%,62.29
small business startup grants bc,0,7,0%,62.86
oregon grants for small business,0,7,0%,63.14
new business loans ontario,0,7,0%,65.71
canada grant for small business,0,7,0%,66.14
ontario small business grant application,0,7,0%,67.14
canada business loan,0,7,0%,67.86
government of canada business loan,0,7,0%,68
small business funding in missouri,0,7,0%,68.29
small business grants in california,0,7,0%,68.86
business expansion grants canada,0,7,0%,69.14
loan for indigenous entrepreneur,0,7,0%,69.14
guaranteed business loan,0,7,0%,70.71
small business loan grants,0,7,0%,73.57
small business funding in oregon,0,7,0%,73.71
ecommerce grants,0,7,0%,74
grants for business start,0,7,0%,74.71
small business loans and grants,0,7,0%,74.71
business loan for women,0,7,0%,75.86
business loan women,0,7,0%,77.14
federal government grants small business,0,7,0%,78
small business loan in canada,0,7,0%,78.71
grant proposals,0,7,0%,80.29
sba grants for small business,0,7,0%,80.57
business startup loans canada,0,7,0%,81.86
can i get government funding to start a business,0,7,0%,85
small business loans wa,0,6,0%,1
"identify consultants for regional economic growth strategies under a $500k 
budget.",0,6,0%,2.67
"nuu-chah-nulth economic development corporation nedc aboriginal financial 
institution loans business advisory",0,6,0%,3.33
"""ohio"" technology innovation grants",0,6,0%,3.83
"what are the hottest small business grant opportunities right now? new 
grants in last 30 days, upcoming deadlines, state-specific grants, grants 
for underserved groups. focus on businesses under $500k revenue. specific 
amounts and deadlines.",0,6,0%,6
canada digital adoption program grant status 2026,0,6,0%,6.83
wyoming small business grants 2026,0,6,0%,7
"canadian government funding for-profit biotech companies clinical trials 
phase 1 phase 2 2026",0,6,0%,7.67
nsf america's seed fund up to $2 million official,0,6,0%,7.67
nsf america's seed fund phase i phase ii funding amounts 2026 official,0,6,0%,8.67
tech startup funding 2026,0,6,0%,9.33
phoenix small business grants 2026,0,6,0%,9.5
federal small business grants sba 2026,0,6,0%,9.83
california innovation grants small business open 2026,0,6,0%,10.67
grants for medtech startups 2026,0,6,0%,11.17
rhode island small business grants 2026,0,6,0%,11.17
seattle small business grants 2026,0,6,0%,11.33
small business grants nyc 2026,0,6,0%,11.67
california startup grants 2026,0,6,0%,12.83
funding for commercialization,0,6,0%,13.17
small business grant options 2026,0,6,0%,14.17
utah small business grants 2026,0,6,0%,15.67
start up ny program,0,6,0%,16.33
washington state department of commerce small business grants 2026,0,6,0%,16.5
agriculture loans fort wayne,0,6,0%,18.83
empire state development fund,0,6,0%,20.67
equity free startup programs,0,6,0%,21.17
who offers the fastest zero-equity funding for an immediate app ua surge?,0,6,0%,25.17
best free accelerators no equity,0,6,0%,25.67
small business funding in minnesota,0,6,0%,25.67
amber grant tips,0,6,0%,26
nsf seed fund,0,6,0%,26.33
canadian government programs,0,6,0%,28.17
export canada grants,0,6,0%,29
minneapolis business loan,0,6,0%,29.33
top consultants cdae ontario,0,6,0%,30
analytical system technology startup funding,0,6,0%,30.67
funding a washington llc,0,6,0%,30.67
industrial innovation funding canada,0,6,0%,31.5
government grants for women,0,6,0%,31.67
space technology funding,0,6,0%,35
bc grants for nonprofit organizations,0,6,0%,35.67
green energy grants canada,0,6,0%,35.67
grants in washington state,0,6,0%,35.83
university at buffalo business funding opportunities,0,6,0%,37
canadian government subsidies,0,6,0%,37.83
canadian federal grants,0,6,0%,38.17
federal funding canada,0,6,0%,38.5
software startup funding,0,6,0%,40.33
free aboriginal grants for starting a business in canada,0,6,0%,40.67
funding in canada,0,6,0%,40.67
apply for a business funding,0,6,0%,41.33
$7000 government grant for individuals canada,0,6,0%,41.67
united states grants,0,6,0%,42.17
revenue based funding minneapolis,0,6,0%,43
small business grants ottawa,0,6,0%,43.83
business grants nyc,0,6,0%,45
canada small business financing program (csbfp),0,6,0%,45.5
apply for a grant canada,0,6,0%,46
missouri business grants,0,6,0%,46.5
canada small business loan $40 000,0,6,0%,47.17
alberta government small business grants,0,6,0%,48.33
alberta business grants and funding,0,6,0%,49.33
funding for tech startup,0,6,0%,49.67